UTC Timestamp Start,UTC Timestamp End,Channel,Title,Description,Duration (Mins),Date (Local),Time (Local)
2025-10-15T12:15:00+00:00,2025-10-15T13:10:00+00:00,Virgin Media More,CL Finals Weekend Barcelona v Man. United 2011,"Barcelona's dominant victory over Manchester United in 2011 at Wembley, in what many consider to be the greatest team performance of any Champions League final.",55,2025-10-15,1.15pm - 2.10pm
2025-10-15T13:10:00+00:00,2025-10-15T14:00:00+00:00,Virgin Media More,Best of u20's Six Nations 2025: Italy v Ireland,Ireland scraped by Italy last year in tight 23-22 late victory. Neil Doak's side know the trip to Treviso will  be a tough ask.,50,2025-10-15,2.10pm - 3.00pm
2025-10-15T14:00:00+00:00,2025-10-15T14:50:00+00:00,Virgin Media More,UEFA European Qualifiers Matchnight Highlights,A round up of all the best of the night's action in the European qualifiers as countries look to qualify for the 2026 FIFA World cup.,50,2025-10-15,3.00pm - 3.50pm
2025-10-15T14:50:00+00:00,2025-10-15T16:45:00+00:00,Virgin Media More,UEFA European Qualifiers 2025/26:Denmark v Greece,Greece host Denmark in a crucial Group C clash as the race for World Cup qualification heats up,115,2025-10-15,3.50pm - 5.45pm
2025-10-15T16:45:00+00:00,2025-10-15T17:15:00+00:00,Virgin Media More,Classic UEFA Champions League: Messi - Barcelona v Chelsea 2018,Some the most classic and most memorable matches from Europe's premier club competition.,30,2025-10-15,5.45pm - 6.15pm
2025-10-15T17:15:00+00:00,2025-10-15T18:10:00+00:00,Virgin Media More,UCL Defining Moment,Celebrating 65-years of European Cup & UEFA Champions League football. Using a combination of UEFA’s vast back-catalogue of archive footage and interviews with coaches and players this serie...,55,2025-10-15,6.15pm - 7.10pm
2025-10-15T18:10:00+00:00,2025-10-15T19:05:00+00:00,Virgin Media More,Classic Six Nations: England v Scotland 2019,A Six Nations all time classic was created in 2019 when bitter rivals England and Scotland went at it hammer and tongs at Twickenham.,55,2025-10-15,7.10pm - 8.05pm
2025-10-15T19:05:00+00:00,2025-10-15T20:00:00+00:00,Virgin Media More,CL Finals Weekend Liverpool v Roma 1984,Some the most classic and most memorable matches from Europe's premier club competition.,55,2025-10-15,8.05pm - 9.00pm
2025-10-15T20:00:00+00:00,2025-10-15T20:50:00+00:00,Virgin Media More,The British Airways Killer,"Taking us inside the complex investigation into the murder of Joanna Simpson, this gripping true crime documentary explores how the marriage of a pilot and a wealthy heiress ended in bitter divorce an...",50,2025-10-15,9.00pm - 9.50pm
2025-10-15T20:50:00+00:00,2025-10-15T21:50:00+00:00,Virgin Media More,Showtrial,"When Talitha Campbell, daughter of one of Britain’s wealthiest families is arrested for the murder of a working-class student Hannah Ellis, the stage is set for a court case that will divide the...",60,2025-10-15,9.50pm - 10.50pm
2025-10-15T21:50:00+00:00,2025-10-15T22:40:00+00:00,Virgin Media More,Born To Kill,"A chilling new collection of serial killers are unmasked in the latest series of this hit crime show. In this season, three US, one Canadian and two UK killers' are recounted through in-depth int...",50,2025-10-15,10.50pm - 11.40pm
2025-10-15T22:40:00+00:00,2025-10-15T23:30:00+00:00,Virgin Media More,UEFA Man In The Middle,"Set during the Group Stage of the 2019/20 UEFA Champions League season, Episode 2 takes a deeper dive into the psychology of refereeing, as some of the top officials find themselves having to make the...",50,2025-10-15,11.40pm - 12.30am
2025-10-16T22:35:00+00:00,2025-10-16T23:35:00+00:00,Virgin Media One,A Rebel Education,"Principal Burke is challenged by disruptive second year Kalen, Mr. O Donovan tackles the  impact of social media and former drop-out Alannah struggles to catch up for leaving cert.",60,2025-10-16,11.35pm - 12.35am
2025-10-15T23:35:00+00:00,2025-10-16T00:05:00+00:00,Virgin Media One,Don't Look Back In Anger,"In a series of 20 half hours, we chronicle the news and highlights of the last 20 years in this archive and music-based series.",30,2025-10-16,12.35am - 1.05am
2025-10-16T00:05:00+00:00,2025-10-16T00:35:00+00:00,Virgin Media One,Don't Look Back In Anger,"In a series of 20 half hours, we chronicle the news and highlights of the last 20 years in this archive and music-based series.",30,2025-10-16,1.05am - 1.35am
2025-10-16T00:35:00+00:00,2025-10-16T01:49:00+00:00,Virgin Media One,World on Fire,"From multi-award-winning writer Peter Bowker, this heart-stopping drama tells the story of World War Two through the lives of ordinary people from all sides of this global conflict. Featuring a stella...",74,2025-10-16,1.35am - 2.49am
2025-10-16T04:25:00+00:00,2025-10-16T05:15:00+00:00,Virgin Media One,The Tonight Show,Comment and analysis on the big stories of the day in Ireland and abroad with a panel of guests covering the key issues.,50,2025-10-16,5.25am - 6.15am
2025-10-16T05:15:00+00:00,2025-10-16T06:00:00+00:00,Virgin Media One,The Six O'Clock Show,"A lively mix of celebrity chat with national and international guests, fabulous food from the country’s top Chefs, expert advice and all the unmissable stories making the headlines.",45,2025-10-16,6.15am - 7.00am
2025-10-16T06:00:00+00:00,2025-10-16T09:00:00+00:00,Virgin Media One,Ireland AM,"Ireland AM is the longest running daytime show in Ireland. Blending a mixture of lifestyle interviews and news content, with gardening, health, food and fashion seven days a week.",180,2025-10-16,7.00am - 10.00am
2025-10-16T09:00:00+00:00,2025-10-16T11:30:00+00:00,Virgin Media One,This Morning,"A mix of celebrity interviews, entertainment news, current affairs discussions, a look at sports competitions, health columns, cooking tips and tricks, and more.",150,2025-10-16,10.00am - 12.30pm
2025-10-16T11:30:00+00:00,2025-10-16T12:00:00+00:00,Virgin Media One,News at 12:30,"The latest national and international news stories from the Virgin Media News team, followed by sport and weather.",30,2025-10-16,12.30pm - 1.00pm
2025-10-16T12:00:00+00:00,2025-10-16T13:00:00+00:00,Virgin Media One,The Chase,"Huge global hit game show The Chase is the ultimate heart-racing, high-pressure quiz.",60,2025-10-16,1.00pm - 2.00pm
2025-10-16T13:00:00+00:00,2025-10-16T14:00:00+00:00,Virgin Media One,The Chase,"Huge global hit game show The Chase is the ultimate heart-racing, high-pressure quiz.",60,2025-10-16,2.00pm - 3.00pm
2025-10-16T14:00:00+00:00,2025-10-16T15:00:00+00:00,Virgin Media One,Loose Women,"Loose Women as they chat about news, issues and life in general.",60,2025-10-16,3.00pm - 4.00pm
2025-10-16T15:00:00+00:00,2025-10-16T15:30:00+00:00,Virgin Media One,Paul O'Grady: For the Love of Dogs,"The comedian prepares to say goodbye to his favourite dog when a couple visit Battersea hoping to adopt Carmine. Meanwhile, a family's enquiry about a lost pet could mean stressed-out Staffie Com...",30,2025-10-16,4.00pm - 4.30pm
2025-10-16T15:30:00+00:00,2025-10-16T16:00:00+00:00,Virgin Media One,Judge Judy,"Presided over by outspoken Judge Judith Sheindlin; with her no-nonsense, decisive approach to justice; she has established herself as a pop-culture icon for generations of viewers.",30,2025-10-16,4.30pm - 5.00pm
2025-10-16T16:00:00+00:00,2025-10-16T16:30:00+00:00,Virgin Media One,Judge Judy,"Presided over by outspoken Judge Judith Sheindlin; with her no-nonsense, decisive approach to justice; she has established herself as a pop-culture icon for generations of viewers.",30,2025-10-16,5.00pm - 5.30pm
2025-10-16T16:30:00+00:00,2025-10-16T17:00:00+00:00,Virgin Media One,News at 5:30,The latest national and international news stories from the Virgin Media News team.,30,2025-10-16,5.30pm - 6.00pm
2025-10-16T17:00:00+00:00,2025-10-16T18:00:00+00:00,Virgin Media One,The Six O'Clock Show,"A lively mix of celebrity chat with national and international guests, fabulous food from the country’s top Chefs, expert advice and all the unmissable stories making the headlines.",60,2025-10-16,6.00pm - 7.00pm
2025-10-16T18:00:00+00:00,2025-10-16T18:30:00+00:00,Virgin Media One,News at 7,"The latest national and international news stories from the Virgin Media News team, followed by sport and weather.",30,2025-10-16,7.00pm - 7.30pm
2025-10-16T18:30:00+00:00,2025-10-16T19:00:00+00:00,Virgin Media One,Emmerdale,Dylan and April are pushed into dangerous situations. Joe’s suggestion brings more conflict. Robert lies to Aaron.,30,2025-10-16,7.30pm - 8.00pm
2025-10-16T19:00:00+00:00,2025-10-16T19:30:00+00:00,Virgin Media One,Emmerdale,Dylan and April are pushed into dangerous situations. Joe’s suggestion brings more conflict. Robert lies to Aaron.,30,2025-10-16,8.00pm - 8.30pm
2025-10-16T19:30:00+00:00,2025-10-16T20:00:00+00:00,Virgin Media One,Call The Cleaners,"From hoarders to squalid homes to toxic toilets, join the trained specialist cleaners as they pull on the rubber gloves and tackle domestic dirt like you’ve never seen before.",30,2025-10-16,8.30pm - 9.00pm
2025-10-16T20:00:00+00:00,2025-10-16T21:05:00+00:00,Virgin Media One,The Hack,"The true story behind one of the most explosive investigations, into the UK’s phone-hacking scandal and its surprising connection to a notorious, unsolved murder.",65,2025-10-16,9.00pm - 10.05pm
2025-10-16T21:05:00+00:00,2025-10-16T22:05:00+00:00,Virgin Media One,The Group Chat,"The famous trio are back. Richard Chambers, Gavan Reilly and Zara King sit down together and discuss the main news stories of the week in an extended round-table conversation.",60,2025-10-16,10.05pm - 11.05pm
2025-10-16T22:05:00+00:00,2025-10-16T23:05:00+00:00,Virgin Media One,The Tower,"Kieran and Baillie share information that could help Sarah secure an arrest, but her reluctance to cooperate leaves them exasperated. Steve is under the spotlight as Shakiel puts his loyalty to the te...",60,2025-10-16,11.05pm - 12.05am
2025-10-16T22:00:00+00:00,2025-10-16T23:05:00+00:00,Virgin Media Two,The Graham Norton Show,Graham Norton gets up close and personal with various celebrities whilst focusing on different aspects of celebrity culture that attract his attention.,65,2025-10-16,11.00pm - 12.05am
2025-10-15T23:05:00+00:00,2025-10-16T00:00:00+00:00,Virgin Media Two,The Real Housewives of Dubai,"The drama is heating up as the dazzling women of Dubai navigate love, business empires and ever-evolving friendships, all while seeing who can shine brightest in the City of Gold.",55,2025-10-16,12.05am - 1.00am
2025-10-16T00:00:00+00:00,2025-10-16T00:43:00+00:00,Virgin Media Two,The Real Housewives of Dubai,"The drama is heating up as the dazzling women of Dubai navigate love, business empires and ever-evolving friendships, all while seeing who can shine brightest in the City of Gold.",43,2025-10-16,1.00am - 1.43am
2025-10-16T05:10:00+00:00,2025-10-16T06:00:00+00:00,Virgin Media Two,The Chase Australia,"The Australian version of the quiz series where four contestants have to compete against a professional quizzer, known as the ""Chaser"", in order to win a cash prize.",50,2025-10-16,6.10am - 7.00am
2025-10-16T06:00:00+00:00,2025-10-16T07:00:00+00:00,Virgin Media Two,The Chase Australia,"The Australian version of the quiz series where four contestants have to compete against a professional quizzer, known as the ""Chaser"", in order to win a cash prize",60,2025-10-16,7.00am - 8.00am
2025-10-16T07:00:00+00:00,2025-10-16T08:00:00+00:00,Virgin Media Two,Tipping Point,Hit Quiz Series hosted by Ben Shepherd which sees four contestants do battle to win big cash prizes...,60,2025-10-16,8.00am - 9.00am
2025-10-16T08:00:00+00:00,2025-10-16T09:00:00+00:00,Virgin Media Two,The Chase,"Huge global hit game show The Chase is the ultimate heart-racing, high-pressure quiz.",60,2025-10-16,9.00am - 10.00am
2025-10-16T09:00:00+00:00,2025-10-16T10:00:00+00:00,Virgin Media Two,The Chase,"Huge global hit game show The Chase is the ultimate heart-racing, high-pressure quiz.",60,2025-10-16,10.00am - 11.00am
2025-10-16T10:00:00+00:00,2025-10-16T11:00:00+00:00,Virgin Media Two,The Chase Australia,"The Australian version of the quiz series where four contestants have to compete against a professional quizzer, known as the ""Chaser"", in order to win a cash prize.",60,2025-10-16,11.00am - 12.00pm
2025-10-16T11:00:00+00:00,2025-10-16T12:00:00+00:00,Virgin Media Two,The Deal Makers,"The show follows the biggest characters from the world of pawn broking as they uncover the stories behind, and the prospective value of, the most amazing objects being bought, sold and loaned against....",60,2025-10-16,12.00pm - 1.00pm
2025-10-16T12:00:00+00:00,2025-10-16T13:00:00+00:00,Virgin Media Two,Who's Doing The Dishes,"Singer Claire from pop group Steps hosts a dinner party for four guests who win a cash prize if they can guess her identity from cryptic culinary clues - and as an added incentive, if they're suc...",60,2025-10-16,1.00pm - 2.00pm
2025-10-16T13:00:00+00:00,2025-10-16T14:00:00+00:00,Virgin Media Two,Yes Chef,"Actress Sheree Murphy presents the cookery competition in which top chefs work with three amateur cooks, selecting one to partner them in the weekly final.",60,2025-10-16,2.00pm - 3.00pm
2025-10-16T14:00:00+00:00,2025-10-16T15:00:00+00:00,Virgin Media Two,The Chase,"Four players answer trivia questions. Then as a team, face a quiz champion (The Chaser) to win thousands of pounds in a timed final quiz. Bradley Walsh hosts.",60,2025-10-16,3.00pm - 4.00pm
2025-10-16T15:00:00+00:00,2025-10-16T16:00:00+00:00,Virgin Media Two,Tipping Point,Hit Quiz Series hosted by Ben Shepherd which sees four contestants do battle to win big cash prizes...,60,2025-10-16,4.00pm - 5.00pm
2025-10-16T16:00:00+00:00,2025-10-16T17:00:00+00:00,Virgin Media Two,Tipping Point,Hit Quiz Series hosted by Ben Shepherd which sees four contestants do battle to win big cash prizes...,60,2025-10-16,5.00pm - 6.00pm
2025-10-16T17:00:00+00:00,2025-10-16T18:00:00+00:00,Virgin Media Two,The Chase,"Huge global hit game show The Chase is the ultimate heart-racing, high-pressure quiz.",60,2025-10-16,6.00pm - 7.00pm
2025-10-16T18:00:00+00:00,2025-10-16T19:00:00+00:00,Virgin Media Two,The Chase,"Huge global hit game show The Chase is the ultimate heart-racing, high-pressure quiz.",60,2025-10-16,7.00pm - 8.00pm
2025-10-16T19:00:00+00:00,2025-10-16T20:00:00+00:00,Virgin Media Two,Celebrity Tipping Point,Four players take on the show’s distinctive machine in a battle of skill and luck.,60,2025-10-16,8.00pm - 9.00pm
2025-10-16T20:00:00+00:00,2025-10-16T22:15:00+00:00,Virgin Media Two,Con Air,Nicolas Cage is a newly-paroled ex-con and former U.S. Ranger Cameron Poe who finds himself trapped in a prisoner-transport plane when the prisoners seize control.,135,2025-10-16,9.00pm - 11.15pm
2025-10-16T22:15:00+00:00,2025-10-16T23:05:00+00:00,Virgin Media Two,Vanderpump Rules,Lisa Vanderpump rules over her exclusive Hollywood restaurant and its lively and mischievous staff--with a platinum fist.,50,2025-10-16,11.15pm - 12.05am
2025-10-16T22:30:00+00:00,2025-10-16T23:25:00+00:00,Virgin Media Three,The Hunt For Raoul Moat,"?Written by Anne screenwriter Kevin Sampson, The Hunt for Raoul Moat shines a light on the human tragedies behind the true story of Britain’s biggest ever manhunt. In 2010, Raoul Moat went on th...",55,2025-10-16,11.30pm - 12.25am
2025-10-15T23:25:00+00:00,2025-10-16T00:25:00+00:00,Virgin Media Three,Autopsy USA,Celebrity autopsy results are combined with the revelations of the late stars' friends and families to offer a comprehensive overview of the events leading up to the icons' untimely deaths.,60,2025-10-16,12.25am - 1.25am
2025-10-16T00:25:00+00:00,2025-10-16T00:55:00+00:00,Virgin Media Three,Schitt's Creek,A married couple suddenly go bankrupt and the only remaining asset they have is an ugly small town named Schitt's Creek.,30,2025-10-16,1.25am - 1.55am
2025-10-16T00:55:00+00:00,2025-10-16T01:16:00+00:00,Virgin Media Three,Schitt's Creek,A married couple suddenly go bankrupt and the only remaining asset they have left is an ugly small town named Schitt's Creek.,21,2025-10-16,1.55am - 2.16am
2025-10-16T05:20:00+00:00,2025-10-16T06:10:00+00:00,Virgin Media Three,Heartbeat,Len Parnaby is disputing a right of way across his land highlighted in a ramblers' guide published by Guy Foxton Treks. Parnaby goes to Ashfordly Police to ask for help but unhappy with their res...,50,2025-10-16,6.20am - 7.10am
2025-10-16T06:10:00+00:00,2025-10-16T06:45:00+00:00,Virgin Media Three,Marcus Wareing: Tales from a Kitchen Garden,"This series follows Marcus - chef extraordinaire and successful restaurateur - as he follows his dream of living, and cooking, in the English countryside.",35,2025-10-16,7.10am - 7.45am
2025-10-16T06:45:00+00:00,2025-10-16T07:40:00+00:00,Virgin Media Three,Wycliffe,Detective Superintendent Wycliffe heads an investigating team of officers brought in to solve the most intriguing of murder cases and uncovers a web of deceit and lies.,55,2025-10-16,7.45am - 8.40am
2025-10-16T07:40:00+00:00,2025-10-16T08:40:00+00:00,Virgin Media Three,The Deal Makers,"The show follows the biggest characters from the world of pawn broking as they uncover the stories behind, and the prospective value of, the most amazing objects being bought, sold and loaned against....",60,2025-10-16,8.40am - 9.40am
2025-10-16T08:40:00+00:00,2025-10-16T10:15:00+00:00,Virgin Media Three,Kavanagh QC,"John Thaw (Goodnight Mister Tom, Inspector Morse) dons the silks of a barrister as James Kavanagh QC, one of the most highly respected criminal advocates in London.",95,2025-10-16,9.40am - 11.15am
2025-10-16T10:15:00+00:00,2025-10-16T11:25:00+00:00,Virgin Media Three,The Darling Buds of May,Ma and Pa Larkin and their six children lead an idyllic life on Home Farm until their rural paradise is shattered by the arrival of inspector Cedric (Charley) Charlton. Charley is to investigate the e...,70,2025-10-16,11.15am - 12.25pm
2025-10-16T11:25:00+00:00,2025-10-16T12:25:00+00:00,Virgin Media Three,Judge Rinder Crime Stories,"Judge Rinder rules the courtroom in his own hit series, but now the respected barrister with a background in criminal defence is stepping out from behind the bench to take on real-life cases. (HD)",60,2025-10-16,12.25pm - 1.25pm
2025-10-16T12:25:00+00:00,2025-10-16T13:25:00+00:00,Virgin Media Three,Heartbeat,"Members of the local constabulary patrol the town of Ashfordly and the nearby village of Aidensfield in North Riding of Yorkshire, keeping the peace while also dealing with local loveable rogues and t...",60,2025-10-16,1.25pm - 2.25pm
2025-10-16T13:25:00+00:00,2025-10-16T14:25:00+00:00,Virgin Media Three,The Hotel Inspector,"Ever stayed at a hotel with less-than-satisfactory service, outdated décor, poor quality food, or an uncomfortable bed? Renowned hotelier and author Ruth Watson is The Hotel Inspector, and she&...",60,2025-10-16,2.25pm - 3.25pm
2025-10-16T14:25:00+00:00,2025-10-16T14:55:00+00:00,Virgin Media Three,Emmerdale,Cain returns but he’s not in a good place. Robert is in a quandary. Laurel makes an admission.,30,2025-10-16,3.25pm - 3.55pm
2025-10-16T14:55:00+00:00,2025-10-16T15:25:00+00:00,Virgin Media Three,Coronation Street,"Todd orders Theo to pack his bags and leave, Betsy accidentally jeopardises Becky’s safety, Abi accuses Kevin of sabotaging a job opportunity, and Cassie rumbles Fiz’s lie.",30,2025-10-16,3.55pm - 4.25pm
2025-10-16T15:25:00+00:00,2025-10-16T15:55:00+00:00,Virgin Media Three,Coronation Street,"Todd orders Theo to pack his bags and leave, Betsy accidentally jeopardises Becky’s safety, Abi accuses Kevin of sabotaging a job opportunity, and Cassie rumbles Fiz’s lie.",30,2025-10-16,4.25pm - 4.55pm
2025-10-16T15:55:00+00:00,2025-10-16T16:55:00+00:00,Virgin Media Three,The Royal,"A face from the past spells trouble for Klein.  Brigid makes a decision about her future.  Ormerod and Weatherill decide to end their relationship, only to find that news has leaked out...  Harper&rsq...",60,2025-10-16,4.55pm - 5.55pm
2025-10-16T16:55:00+00:00,2025-10-16T18:55:00+00:00,Virgin Media Three,Lewis,"Inspector Robert Lewis and his younger sidekick, Detective Sergeant James Hathaway, solve many crimes that the inhabitants of Oxford throw at them.",120,2025-10-16,5.55pm - 7.55pm
2025-10-16T18:55:00+00:00,2025-10-16T20:00:00+00:00,Virgin Media Three,Heartbeat,"Members of the local constabulary patrol the town of Ashfordly and the nearby village of Aidensfield in North Riding of Yorkshire, keeping the peace while also dealing with local loveable rogues and t...",65,2025-10-16,7.55pm - 9.00pm
2025-10-16T20:00:00+00:00,2025-10-16T21:00:00+00:00,Virgin Media Three,Bletchley Circle,"In 1952, four women who worked at the wartime code-breaking centre, Bletchley Park, reunite to track down a serial killer.",60,2025-10-16,9.00pm - 10.00pm
2025-10-16T21:00:00+00:00,2025-10-16T21:30:00+00:00,Virgin Media Three,Emmerdale,Dylan and April are pushed into dangerous situations. Joe’s suggestion brings more conflict. Robert lies to Aaron.,30,2025-10-16,10.00pm - 10.30pm
2025-10-16T21:30:00+00:00,2025-10-16T22:00:00+00:00,Virgin Media Three,Emmerdale,Dylan and April are pushed into dangerous situations. Joe’s suggestion brings more conflict. Robert lies to Aaron.,30,2025-10-16,10.30pm - 11.00pm
2025-10-16T22:00:00+00:00,2025-10-16T22:35:00+00:00,Virgin Media Three,Faithless,"It’s a day of mixed emotions as the headstone is finally set at Tracy’s graveside. Lina has a new boyfriend in college, Sam’s not keen. Sam realises he likes Nancy’s teacher.",35,2025-10-16,11.00pm - 11.35pm
2025-10-16T22:35:00+00:00,2025-10-16T23:40:00+00:00,Virgin Media Three,Cracker,"Multi award winning and critically-acclaimed detective drama strand starring Robbie Coltrane (Ocean's Twelve; The World Is Not Enough; Hagrid in Harry Potter) as the wise-cracking Fitz, a brillia...",65,2025-10-16,11.35pm - 12.40am
2025-10-16T22:55:00+00:00,2025-10-17T01:15:00+00:00,Virgin Media Four,This Morning,"A mix of celebrity interviews, entertainment news, current affairs discussions, a look at sports competitions, health columns, cooking tips and tricks, and more.",140,2025-10-16,11.55pm - 2.15am
2025-10-16T06:20:00+00:00,2025-10-16T07:10:00+00:00,Virgin Media Four,The Tonight Show,Comment and analysis on the big stories of the day in Ireland and abroad with a panel of guests covering the key issues.,50,2025-10-16,7.20am - 8.10am
2025-10-16T07:10:00+00:00,2025-10-16T08:00:00+00:00,Virgin Media Four,Best of u20's Six Nations 2025: Ireland v France,Ireland go head to head against a formidable France side at Virgin Media Park in Round 4 of the U20 6 Nations.,50,2025-10-16,8.10am - 9.00am
2025-10-16T08:00:00+00:00,2025-10-16T09:00:00+00:00,Virgin Media Four,Loose Women,"Loose Women as they chat about news, issues and life in general.",60,2025-10-16,9.00am - 10.00am
2025-10-16T09:00:00+00:00,2025-10-16T10:00:00+00:00,Virgin Media Four,Good Witch,Cassie tries to convince Sam to follow her intuition in order to help a young couple,60,2025-10-16,10.00am - 11.00am
2025-10-16T10:00:00+00:00,2025-10-16T11:00:00+00:00,Virgin Media Four,Good Witch,A storm continues to threaten the lives of the people in Middleton; Cassie and Sam work together.,60,2025-10-16,11.00am - 12.00pm
2025-10-16T11:00:00+00:00,2025-10-16T12:00:00+00:00,Virgin Media Four,The Cube,"The Cube which tests contestants' ability, nerve and determination to win.",60,2025-10-16,12.00pm - 1.00pm
2025-10-16T12:00:00+00:00,2025-10-16T12:55:00+00:00,Virgin Media Four,John & Lisa's Weekend Kitchen,"John Torode and Lisa Faulkner invite us into their kitchen for a morning of feel good food. Brimming with recipes, shortcuts, inspiration and tips from top chef John and champion cook Lisa, everyone i...",55,2025-10-16,1.00pm - 1.55pm
2025-10-16T12:55:00+00:00,2025-10-16T13:50:00+00:00,Virgin Media Four,The Six O'Clock Show,"A lively mix of celebrity chat with national and international guests, fabulous food from the country’s top Chefs, expert advice and all the unmissable stories making the headlines.",55,2025-10-16,1.55pm - 2.50pm
2025-10-16T13:50:00+00:00,2025-10-16T14:50:00+00:00,Virgin Media Four,Animal Emergency,"The UCD Veterinary Hospital, based in Dublin, is a unique environment that prides itself on its speciality services, delivered with modern equipment and cutting-edge technology, serving the veterinary...",60,2025-10-16,2.50pm - 3.50pm
2025-10-16T14:50:00+00:00,2025-10-16T15:25:00+00:00,Virgin Media Four,Mountain Vets,Documentary series following the busy mountain vets at the ancient Kingdom of Mourne,35,2025-10-16,3.50pm - 4.25pm
2025-10-16T15:25:00+00:00,2025-10-16T15:55:00+00:00,Virgin Media Four,Paul O'Grady: For the Love of Dogs,"Paul O’Grady returns to Battersea Dogs and Cats Home. As ever, Paul continues to bring his unique blend of humour, entertainment and fun as he helps care for dogs of all different shapes, sizes ...",30,2025-10-16,4.25pm - 4.55pm
2025-10-16T15:55:00+00:00,2025-10-16T17:00:00+00:00,Virgin Media Four,Puppy Secrets - The First Six Months,"Everyone loves puppies. They are cute, cuddly, and clumsy – a joy to watch, and even more of a joy to have in the home.",65,2025-10-16,4.55pm - 6.00pm
2025-10-16T17:00:00+00:00,2025-10-16T18:00:00+00:00,Virgin Media Four,My Unique B&B,"All around the country lie unique spaces, in beautiful places: campervans; sheds, attics; caravans even horseboxes!  They are unloved and unused... until now!",60,2025-10-16,6.00pm - 7.00pm
2025-10-16T18:00:00+00:00,2025-10-16T19:00:00+00:00,Virgin Media Four,The Salvage Squad,"Brian Dowling and his fashion-forward design team are on a mission to prove to the nation that you 
can achieve the home renovation of your dreams without it literally costing the earth. 
Changing Roo...",60,2025-10-16,7.00pm - 8.00pm
